{"$schema":"https://json-schema.org/draft/2020-12/schema","$id":"https://agentic-query.dev/spec/query-ast/v0.1/query.schema.json","title":"Agentic Query AST v0.1","type":"object","additionalProperties":false,"required":["source","select"],"properties":{"source":{"$ref":"#/$defs/entityRef"},"select":{"type":"array","minItems":1,"items":{"$ref":"#/$defs/selectExpression"}},"joins":{"type":"array","items":{"$ref":"#/$defs/join"}},"filters":{"type":"array","items":{"$ref":"#/$defs/filter"}},"groupBy":{"type":"array","items":{"$ref":"#/$defs/fieldRef"}},"having":{"type":"array","items":{"$ref":"#/$defs/filter"}},"orderBy":{"type":"array","items":{"$ref":"#/$defs/orderBy"}},"limit":{"type":"integer","minimum":1,"maximum":10000},"offset":{"type":"integer","minimum":0}},"$defs":{"entityRef":{"type":"object","additionalProperties":false,"required":["name"],"properties":{"name":{"type":"string","minLength":1}}},"fieldRef":{"type":"object","additionalProperties":false,"required":["field"],"properties":{"entity":{"type":"string","minLength":1},"field":{"type":"string","minLength":1}}},"selectExpression":{"type":"object","additionalProperties":false,"required":["field"],"properties":{"field":{"$ref":"#/$defs/fieldRef"},"aggregate":{"enum":["count","sum","avg","min","max"]},"alias":{"type":"string","minLength":1}}},"filter":{"type":"object","additionalProperties":false,"required":["field","operator"],"properties":{"field":{"$ref":"#/$defs/fieldRef"},"operator":{"enum":["eq","neq","gt","gte","lt","lte","in","not_in","like","is_null","is_not_null","between"]},"value":{},"values":{"type":"array"}}},"join":{"type":"object","additionalProperties":false,"required":["entity","type","on"],"properties":{"entity":{"$ref":"#/$defs/entityRef"},"type":{"enum":["inner","left"]},"on":{"type":"object","additionalProperties":false,"required":["left","right"],"properties":{"left":{"$ref":"#/$defs/fieldRef"},"right":{"$ref":"#/$defs/fieldRef"}}}}},"orderBy":{"type":"object","additionalProperties":false,"required":["field","direction"],"properties":{"field":{"$ref":"#/$defs/fieldRef"},"direction":{"enum":["asc","desc"]}}}}}
